{
  "scenario_id": "2007-06",
  "events": [
    {
      "month": "2008-09",
      "title": "The financial crisis intensifies",
      "description": "Lehman Brothers files for bankruptcy. Authorities support other financial firms as stress spreads.",
      "source_ids": ["financial-crisis"]
    },
    {
      "month": "2010-04",
      "title": "Deepwater Horizon disaster",
      "description": "An offshore drilling explosion kills workers and leads to a major oil spill.",
      "source_ids": ["deepwater"]
    },
    {
      "month": "2011-03",
      "title": "Japan is struck by an earthquake and tsunami",
      "description": "Coastal communities suffer devastating damage and begin a long recovery.",
      "source_ids": ["japan-quake"]
    }
  ],
  "what_happened_next": {
    "text": "Apple grew to almost five times its starting value. Disney gained about 52% and Microsoft about 16%; the U.S. share basket ended only slightly higher, close to cash. Strong business results did not make every share or basket rise at the same pace.\n\nIn April 2012, Apple reported record March-quarter sales of 35.1 million iPhones and 11.8 million iPads, with profit almost twice the year-earlier level. Microsoft’s quarter showed growth in Office, server products and Windows, while its Xbox and devices division slowed. Disney reported higher sales and earnings, while its CEO pointed to the record opening of The Avengers. These companies earned money in different ways, and each faced competition.\n\nThe financial crisis intensified when Lehman Brothers filed for bankruptcy in September 2008. The Deepwater Horizon disaster and Japan’s earthquake and tsunami followed. None of those events was visible on a complete timeline when people began this game. Apple’s gain does not mean an iPhone announcement made its later price obvious. Its results, costs and expectations changed over time, while the broad U.S. and international baskets followed different paths through the same years.",
    "source_ids": [
      "french-us",
      "french-international",
      "fred-gs5",
      "yahoo-aapl",
      "yahoo-msft",
      "yahoo-dis",
      "financial-crisis",
      "deepwater",
      "japan-quake",
      "apple-q2-2012",
      "microsoft-q3-2012",
      "disney-q2-2012"
    ]
  },
  "reflection": {
    "what_people_were_focused_on": "Touchscreens and the iPhone attracted attention, while Disney changed direction and communities faced political and economic uncertainty.",
    "what_actually_mattered": "The different paths mattered. A broad foreign basket and a US basket did not move alike, and one highly successful company outpaced both.",
    "what_faded_away": "A memorable product demonstration did not reveal the size of future returns. It also did not remove the risks of owning a single share.",
    "what_nobody_knew": "The financial crisis was still ahead. Even someone excited about the iPhone could not know its full business effect or the investment path.",
    "source_ids": [
      "french-us",
      "french-international",
      "fred-gs5",
      "yahoo-aapl",
      "yahoo-msft",
      "yahoo-dis",
      "financial-crisis",
      "deepwater",
      "japan-quake"
    ]
  },
  "hot_stock_explanations": {
    "hot:2007-06:apple": {
      "text": "In April 2012, Apple reported selling 35.1 million iPhones and 11.8 million iPads in its March quarter. Sales reached $39.2 billion, and net profit was $11.6 billion, almost twice the year-earlier amount. Phones and tablets were bringing Apple both more customers and much larger profits.",
      "source_ids": ["apple-q2-2012"]
    },
    "hot:2007-06:microsoft": {
      "text": "In April 2012, Microsoft reported quarterly sales of $17.4 billion, up 6% from a year earlier. Office and server software helped drive growth, and Windows sales rose too. Its Xbox and devices division shrank as the games-console market slowed, showing why the company depended on several businesses.",
      "source_ids": ["microsoft-q3-2012"]
    },
    "hot:2007-06:disney": {
      "text": "Disney reported in May 2012 that quarterly sales rose 6% and net profit rose 21% from a year earlier. That month, The Avengers opened with a record $207 million weekend in the U.S. and Canada. The Marvel characters Disney had bought were now drawing large cinema audiences.",
      "source_ids": ["disney-q2-2012"]
    }
  },
  "monthly_returns": {
    "cash": [
      { "month": "2007-07", "return": 0.004 },
      { "month": "2007-08", "return": 0.0042 },
      { "month": "2007-09", "return": 0.0032 },
      { "month": "2007-10", "return": 0.0032 },
      { "month": "2007-11", "return": 0.0034000000000000002 },
      { "month": "2007-12", "return": 0.0027 },
      { "month": "2008-01", "return": 0.0021 },
      { "month": "2008-02", "return": 0.0013 },
      { "month": "2008-03", "return": 0.0017000000000000001 },
      { "month": "2008-04", "return": 0.0018 },
      { "month": "2008-05", "return": 0.0018 },
      { "month": "2008-06", "return": 0.0017000000000000001 },
      { "month": "2008-07", "return": 0.0015 },
      { "month": "2008-08", "return": 0.0013 },
      { "month": "2008-09", "return": 0.0015 },
      { "month": "2008-10", "return": 0.0008 },
      { "month": "2008-11", "return": 0.0003 },
      { "month": "2008-12", "return": 0 },
      { "month": "2009-01", "return": 0 },
      { "month": "2009-02", "return": 0.0001 },
      { "month": "2009-03", "return": 0.0002 },
      { "month": "2009-04", "return": 0.0001 },
      { "month": "2009-05", "return": 0 },
      { "month": "2009-06", "return": 0.0001 },
      { "month": "2009-07", "return": 0.0001 },
      { "month": "2009-08", "return": 0.0001 },
      { "month": "2009-09", "return": 0.0001 },
      { "month": "2009-10", "return": 0 },
      { "month": "2009-11", "return": 0 },
      { "month": "2009-12", "return": 0.0001 },
      { "month": "2010-01", "return": 0 },
      { "month": "2010-02", "return": 0 },
      { "month": "2010-03", "return": 0.0001 },
      { "month": "2010-04", "return": 0.0001 },
      { "month": "2010-05", "return": 0.0001 },
      { "month": "2010-06", "return": 0.0001 },
      { "month": "2010-07", "return": 0.0001 },
      { "month": "2010-08", "return": 0.0001 },
      { "month": "2010-09", "return": 0.0001 },
      { "month": "2010-10", "return": 0.0001 },
      { "month": "2010-11", "return": 0.0001 },
      { "month": "2010-12", "return": 0.0001 },
      { "month": "2011-01", "return": 0.0001 },
      { "month": "2011-02", "return": 0.0001 },
      { "month": "2011-03", "return": 0.0001 },
      { "month": "2011-04", "return": 0 },
      { "month": "2011-05", "return": 0 },
      { "month": "2011-06", "return": 0 },
      { "month": "2011-07", "return": 0 },
      { "month": "2011-08", "return": 0.0001 },
      { "month": "2011-09", "return": 0 },
      { "month": "2011-10", "return": 0 },
      { "month": "2011-11", "return": 0 },
      { "month": "2011-12", "return": 0 },
      { "month": "2012-01", "return": 0 },
      { "month": "2012-02", "return": 0 },
      { "month": "2012-03", "return": 0 },
      { "month": "2012-04", "return": 0 },
      { "month": "2012-05", "return": 0.0001 },
      { "month": "2012-06", "return": 0 }
    ],
    "bonds": [
      { "month": "2007-07", "return": 0.010736856611094359 },
      { "month": "2007-08", "return": 0.023915201409164588 },
      { "month": "2007-09", "return": 0.013892737167825908 },
      { "month": "2007-10", "return": 0.00349999999999695 },
      { "month": "2007-11", "return": 0.027309374074491855 },
      { "month": "2007-12", "return": 0.011179848237881318 },
      { "month": "2008-01", "return": 0.026206053698037524 },
      { "month": "2008-02", "return": 0.011664319661798261 },
      { "month": "2008-03", "return": 0.016189396332025208 },
      { "month": "2008-04", "return": -0.014434954617820961 },
      { "month": "2008-05", "return": -0.011736260974926416 },
      { "month": "2008-06", "return": -0.012715639264139433 },
      { "month": "2008-07", "return": 0.011520631710481233 },
      { "month": "2008-08", "return": 0.010030699682989086 },
      { "month": "2008-09", "return": 0.014522893924165725 },
      { "month": "2008-10", "return": 0.009294142022471918 },
      { "month": "2008-11", "return": 0.022716494557362354 },
      { "month": "2008-12", "return": 0.03836438636516126 },
      { "month": "2009-01", "return": -0.0025135121217055856 },
      { "month": "2009-02", "return": -0.011340259206731207 },
      { "month": "2009-03", "return": 0.0039081823921351955 },
      { "month": "2009-04", "return": -0.00036136428463873216 },
      { "month": "2009-05", "return": -0.011042932704082187 },
      { "month": "2009-06", "return": -0.024895359889559376 },
      { "month": "2009-07", "return": 0.013824596571548886 },
      { "month": "2009-08", "return": -0.0030254908726609075 },
      { "month": "2009-09", "return": 0.011415073455796731 },
      { "month": "2009-10", "return": 0.003831498304122327 },
      { "month": "2009-11", "return": 0.00659429501227482 },
      { "month": "2009-12", "return": -0.0032457872246406394 },
      { "month": "2010-01", "return": -0.004523940510500202 },
      { "month": "2010-02", "return": 0.0076320727651892906 },
      { "month": "2010-03", "return": -0.0012742642062797405 },
      { "month": "2010-04", "return": -0.004894433314300284 },
      { "month": "2010-05", "return": 0.020783335844379414 },
      { "month": "2010-06", "return": 0.01023878310045756 },
      { "month": "2010-07", "return": 0.01296260477286948 },
      { "month": "2010-08", "return": 0.015213814015429206 },
      { "month": "2010-09", "return": 0.004073452348512863 },
      { "month": "2010-10", "return": 0.01215630714698479 },
      { "month": "2010-11", "return": -0.0070992481982475875 },
      { "month": "2010-12", "return": -0.0260596348230393 },
      { "month": "2011-01", "return": -0.0011997283247529023 },